<?xml version="1.0" encoding="UTF-8"?>
<!--
To change this license header, choose License Headers in Project Properties.
To change this template file, choose Tools | Templates
and open the template in the editor.
-->


<MyMsg
    xmlns:xsi='http://www.w3.org/2001/XMLSchema-instance'
    xsi:noNamespaceSchemaLocation='file:/home/eltntawy/ITI/Java/Java-Labs/src/main/java/xml/api/lab2/XmlSchema.xsd'>
    
    
    <header>
            Message from Sender
    </header>
    <Msg>
        <from>eltntawy@gmail.com</from>
        <to>eltntawy@gmail.com</to>
        <to>eltntawy@gmail.com</to>
        <data>This is message Data</data>
        <body>This is message Body</body>
    </Msg>
    
</MyMsg>
